file_name,uni,wylie,url,dept,grade,char_len,audio_len,path,inf
STT_NW0012_0372_2410774_to_2419632,ལོ་དེ་ག་ཚོད་ཚར་བ་དང་། ད་གསང་སྤྱོད་ལས་གཞི་ཆ་ཚང་ཞིག་ཚར་བ་ཡིན་ད་ཟེར་ཡ་ཞིག་དགོས་ཀི་ཡོད་རེད། ད་སྔོན་མ་ནང་བཞིན། ང་ཚོས་རྩྭ་དང་ཤིང་དང་དེ་འདྲས་ཀི་རྒྱག་གི་ཡོད་མ་རེད་བ།  ,lo de ga tshod tshar ba dang /_da gsang spyod las gzhi cha tshang zhig tshar ba yin da zer ya zhig dgos ki yod red/_da sngon ma nang bzhin/_nga tshos rtswa dang shing dang de 'dras ki rgyag gi yod ma red ba/__,https://d38pmlk0v88drf.cloudfront.net/wav16k/STT_NW0012_0372_2410774_to_2419632.wav,STT_NW,3,159,8.858,wav16k/STT_NW0012_0372_2410774_to_2419632.wav,ལོ་འདི་ག་ཙི་ཅིག་ཚར་བ་དང་། ད་གསང་སྤྱོད་ལས་གཞི་ཆ་ཚང་ཅིག་ཚར་བ་ཡིན་ད། ཟེར་ཡ་ཅིག་དགོས་ཀི་ཡོད་རེད། ད་སྔོན་མ་ནང་བཞིན། ང་ཚོས་རྩ་དང་ཤིང་དང་དེ་འདྲས་གི་རྒྱབ་ཀི་ཡོད་མ་རེད་བ།
STT_NW0012_0386_2495737_to_2499755,རྒྱ་གར་གཞུང་གི་ལས་སླ་རུ་འགྲོ་གི་མ་རེད། དེ་འདྲས་བྱས་པ་ཡིན་ན། ཨེ་ནས།  ,rgya gar gzhung gi las sla ru 'gro gi ma red/_de 'dras byas pa yin na/_e nas/__,https://d38pmlk0v88drf.cloudfront.net/wav16k/STT_NW0012_0386_2495737_to_2499755.wav,STT_NW,3,68,4.018,wav16k/STT_NW0012_0386_2495737_to_2499755.wav,རྒྱ་གར་གཞུང་གིས་ལས་སླ་རུ་འགྲོ་གི་མ་རེད། དེ་འདྲས་བྱས་པ་ཡིན་ན། ཨེ་ནས།
STT_NW0012_0393_2534426_to_2538300,གཞན་པས་ཁེར་འགྲོ་བ་འདྲ་བོ་ཞིག་ཡིན་པ་ཡིན་ན། དེ་ང་ཚོ་ཚང་མ་ལོ་ལ་གྱོང་གུན་ཆགས་ཀི་འདུག་ག ,gzhan pas kher 'gro ba 'dra bo zhig yin pa yin na/_de nga tsho tshang ma lo la gyong gun chags ki 'dug ga_,https://d38pmlk0v88drf.cloudfront.net/wav16k/STT_NW0012_0393_2534426_to_2538300.wav,STT_NW,3,83,3.874,wav16k/STT_NW0012_0393_2534426_to_2538300.wav,གཞན་པ་ཁེར་འགྲོ་བ་འདྲ་བོ་ཞིག་ཡིན་པ་ཡིན་ན། དེ་ང་ཚོ་ཚང་མ་ལོ་ལ་གྱོང་གུལ་ཆགས་ཀི་འདུག་ག
STT_PC0156_0178_1149543_to_1154631,འདི་ཡག་ཤོས་དེ་ནུབ་བྱང་མི་རིགས་སློབ་གྲྭ་ཆེན་མོ། ཀྲུང་དབྱངས་མི་རིགས་སློབ་གྲྭ་ཆེན་མོ། འོ་དེ་གས་གིས་ཞིབ་འཇུག་ཡག་པོ་བྱས་ཡོད་རེད།  ,'di yag shos de nub byang mi rigs slob grwa chen mo/_krung dbyangs mi rigs slob grwa chen mo/_'o de gas gis zhib 'jug yag po byas yod red/__,https://d38pmlk0v88drf.cloudfront.net/wav16k/STT_PC0156_0178_1149543_to_1154631.wav,STT_PC,3,125,5.088,wav16k/STT_PC0156_0178_1149543_to_1154631.wav,འདི་ཡག་ཤོས་དེ་ནུབ་བྱང་མི་རིགས་སློབ་གྲྭ་ཆེན་མོ། ཀྲུང་དབྱངས་མི་རིགས་སློབ་གྲྭ་ཆེན་མོ། ཨོ་དེ་གས་ཀི་ཞིབ་འཇུག་ཡག་པོ་བྱས་ཡོད་རེད།
STT_PC0156_0181_1167207_to_1170215,གིས་ཨེ་ནས་བརྩམས་བཞག་རྒྱོ་གི་བརྩམས་ཆོས་མང་པོ་ཡོད་རེད། དེ་ཚོ་ལ་བལྟས་དུས།  ,gis e nas brtsams bzhag rgyo gi brtsams chos mang po yod red/_de tsho la bltas dus/__,https://d38pmlk0v88drf.cloudfront.net/wav16k/STT_PC0156_0181_1167207_to_1170215.wav,STT_PC,3,72,3.008,wav16k/STT_PC0156_0181_1167207_to_1170215.wav,གིས་ཨེ་ནས་བརྩམས་བཞག་རྒྱོ་གི་བརྩམས་ཆོང་མང་པོ་ཡོད་རེད། དེ་ཚོ་ལ་བལྟས་དུས།
STT_MV0468_0154_1829428_to_1839002,ཁ་གཡར་ས་བཙལ་བྱས། ཁོང་ཚོས་ང་ཚོར་དམག་བརྡ་གཏང་གི་ཡོད་རེད། ཁོང་ཚོས་དམག་བརྒྱབ་དོ་ཟེར་དུས། ཁོང་ཚོར་རྒྱལ་ཁ་ཐོབ་ཤག་བྱེད་ཀི་ཡོད་རེད། དམག་སྤྱི་མཆོག བྱས་ཙང་བརྙད་རྐོ་གི་ཡོད་རེད།  ,kha g.yar sa btsal byas/_khong tshos nga tshor dmag brda gtang gi yod red/_khong tshos dmag brgyab do zer dus/_khong tshor rgyal kha thob shag byed ki yod red/_dmag spyi mchog_byas tsang brnyad rko gi yod red/__,https://d38pmlk0v88drf.cloudfront.net/wav16k/STT_MV0468_0154_1829428_to_1839002.wav,STT_MV,3,167,9.574,wav16k/STT_MV0468_0154_1829428_to_1839002.wav,ཁ་གཡར་ཙི་བཙལ་བྱས། ཁོང་ཚོས་ང་ཚོར་དམག་རྡ་གཏང་གི་ཡོད་རེད། ཁོང་ཚོས་དམག་བརྒྱབ་དང་ཟེར་དུས། ཁོང་ཚོར་རྒྱལ་ཁ་ཐོབ་བཤག་བྱེད་ཀི་ཡོད་རེད། དམག་སྤྱི་མཆོག བྱས་ཙང་བསྙད་བརྐུ་གི་ཡོད་རེད།
STT_NW0012_0379_2457231_to_2462304,དེ་འགྲིག་གི་འདུག་བསམ་པ་གཅིག་པུས་འགྲིག་གི་ཡོད་མ་རེད། མ་འོངས་པ་ང་ཚོ། རྒྱ་གར་ཡུལ་མི་མཉམ་དུ་དཀའ་ངལ་ཆེན་པོ་འཕྲད་ཀི་རེད།  ,de 'grig gi 'dug bsam pa gcig pus 'grig gi yod ma red/_ma 'ongs pa nga tsho/_rgya gar yul mi mnyam du dka' ngal chen po 'phrad ki red/__,https://d38pmlk0v88drf.cloudfront.net/wav16k/STT_NW0012_0379_2457231_to_2462304.wav,STT_NW,3,116,5.073,wav16k/STT_NW0012_0379_2457231_to_2462304.wav,དེ་འགྲིག་གི་འདུག་བསམ་པ་གཅིག་པུ་འགྲིག་གི་ཡོད་མ་རེད། མ་འོངས་པ་ང་ཚོས་རྒྱ་གར་ཡུལ་མི་མཉམ་དུ་དཀའ་ངལ་ཆེན་པོ་འཕྲད་ཀི་རེད།
STT_NW0012_0384_2480882_to_2486805,སོ་སོ་ཕྱི་རྒྱལ་ལ་བསྡད་ཡོད་པ་བྱས། ས་ཆ་འདིར་བདག་པོ་བརྒྱབ་བསྡད་ཡོད་ན། མ་འོངས་པ་གནས་སྟངས་ག་རེ་ཆགས་ཀི་ཡོད་མེད། ང་ཚོ་སུ་གཅིག་གིས་ཞུ་ཐུབ་ཀི་མ་རེད་ད།  ,so so phyi rgyal la bsdad yod pa byas/_sa cha 'dir bdag po brgyab bsdad yod na/_ma 'ongs pa gnas stangs ga re chags ki yod med/_nga tsho su gcig gis zhu thub ki ma red da/__,https://d38pmlk0v88drf.cloudfront.net/wav16k/STT_NW0012_0384_2480882_to_2486805.wav,STT_NW,3,143,5.923,wav16k/STT_NW0012_0384_2480882_to_2486805.wav,སོ་སོ་ཕྱི་རྒྱལ་ལ་འད་ཡོད་པ་བྱས། ས་ཆ་འདེར་བདག་པོ་བརྒྱབ་བསྡད་ཡོད་ན། མ་འོངས་པར་གནས་སྟངས་ག་རེ་ཆགས་ཀི་ཡོད་མེད། ང་ཚོས་སུ་གཅིག་ལི་ཞུ་ཐུབ་ཀི་མ་རེད་ད།
STT_NW0012_0399_2564999_to_2569308,གཞི་ཆགས་གནས་སྤོས་ལས་གཞི། ག་རེ་བྱེད་དགོས་ཀི་ཡོད་ནས། ས་ཆ་ཞིག་ཡོད་རེད་བ་དང་པོ།  ,gzhi chags gnas spos las gzhi/_ga re byed dgos ki yod nas/_sa cha zhig yod red ba dang po/__,https://d38pmlk0v88drf.cloudfront.net/wav16k/STT_NW0012_0399_2564999_to_2569308.wav,STT_NW,3,77,4.309,wav16k/STT_NW0012_0399_2564999_to_2569308.wav,གཞིས་ཆགས་གནས་སྤོའི་ལས་གཞི་ཡིན་ན། ག་རེ་བྱེད་དགོས་ཀི་ཡོད་ན། ས་ཆ་གཅིག་ཡོད་རེད་བ་ དང་པོ།
STT_NW0012_0405_2598466_to_2606971,གཅིག་ཡང་བྱས་མ་སོང་ཟེར། ད་ལྟ་ཁྱོད་རང་ཚོས་སྐད་ཆ་བཤད་པ་ནང་བཞིན་བྱས་གཅིག མ་འོངས་པ་བཤད་པ་ཡིན་ན། དེ་ངས་ཁས་ལེན་གི་མ་རེད་ད་ཟེར། ཡང་མིན་ན། མ་འགྲིག་པའི་ས་ཆ་ཞིག་དགོས་ཀི་ཡོད་རེད།  ,gcig yang byas ma song zer/_da lta khyod rang tshos skad cha bshad pa nang bzhin byas gcig_ma 'ongs pa bshad pa yin na/_de ngas khas len gi ma red da zer/_yang min na/_ma 'grig pa'i sa cha zhig dgos ki yod red/__,https://d38pmlk0v88drf.cloudfront.net/wav16k/STT_NW0012_0405_2598466_to_2606971.wav,STT_NW,3,168,8.505,wav16k/STT_NW0012_0405_2598466_to_2606971.wav,གཅིག་ཡེ་བྱས་མ་སོང་ཟེར་ན། ད་ལྟ་ཁྱེད་རང་ཚོས་སྐད་ཆ་བཤད་པ་ནང་བཞིན་ཅིག་མ་འོངས་པ་བཤད་པ་ཡིན་ན། དེ་ངས་ཁས་ལེན་གི་མ་རེད་ད་ཟེ། ཡང་མིན་ན་མ་འགྲིག་པའི་ས་ཆ་ཞིག་དགོས་ཀི་ཡོད་རེད།
STT_NW0012_0406_2606971_to_2613572,ས་ཆ་ཉོ་ཐུབ་དགོས་ཀི་ཡོད་རེད། དེ་ཡང་ཁོ་ཁྲིམས་མཐུན་གི་ཉོ་ཐུབ་དགོས་ཀི་ཡོད་རེད་མ་གཏོགས། དེ་རིང་ས་ཆ་ཞིག་ཉོས། ཡང་སང་ཉིན་དཀའ་ངལ་འཕྲད་ཡ་ཞིག་བྱས་ན། ཁོ་འགྲིག་གི་ཡོད་མ་རེད།  ,sa cha nyo thub dgos ki yod red/_de yang kho khrims mthun gi nyo thub dgos ki yod red ma gtogs/_de ring sa cha zhig nyos/_yang sang nyin dka' ngal 'phrad ya zhig byas na/_kho 'grig gi yod ma red/__,https://d38pmlk0v88drf.cloudfront.net/wav16k/STT_NW0012_0406_2606971_to_2613572.wav,STT_NW,3,162,6.601,wav16k/STT_NW0012_0406_2606971_to_2613572.wav,ས་ཆ་ཉོ་ཐུབ་དགོས་ཀི་ཡོད་རེད། དེ་ཡང་ཁོ་ཁྲིམས་མཐུན་གི་ཉོ་ཐུབ་དགོས་ཀི་ཡོ་རེད་མ་གཏོགས། དེ་རིང་ས་ཆ་ཅིག་ཉོས། ཡང་སང་ཉིན་དཀའ་ངལ་འཕྲད་ཡ་བྱས་ན་འགྲིག་གི་ཡོད་མ་རེད།
STT_NW0012_0410_2634235_to_2638060,ཨེ་ནས། ཁྱིམ་ཚང་བཅུ་གསུམ་དེ་ལ་མི་བལྟ་མྱི་གཅིག་བཞག མི་དེ་ལ་གླ་ཆ་ཞིག་སྤྲད།  ,e nas/_khyim tshang bcu gsum de la mi blta myi gcig bzhag_mi de la gla cha zhig sprad/__,https://d38pmlk0v88drf.cloudfront.net/wav16k/STT_NW0012_0410_2634235_to_2638060.wav,STT_NW,3,73,3.825,wav16k/STT_NW0012_0410_2634235_to_2638060.wav,ཨེ་ནས་ ཁྱིམ་ཚང་བཅུ་གསུམ་དེ་ལ་མི་ལྟ་མྱི་གཅིག་བཞག མི་དེ་ལ་གླ་གཅིག་སྤྲད།
STT_NW0012_0411_2638060_to_2646326,གཅིག ཁང་པ་བཅུ་གསུམ་དེ་སྐྱེས་དེ། སོ་སོ་ལམ་སང་བསྡད་མ་ཐུབ་པ་ཡིན་ནས། ད་ཕྱི་རྒྱལ་གི་དེང་སང་ཨེ་ཨར་སྦི་ཨེ་ཟེར་ཡ་བཟོ་འདྲ་བོ་དང་། རྒྱ་གར་ནང་ལ་ང་ཚོ་ཧོམ་སི་ཌི་ཟེར་ཡ་བཟོ་དེ་འདྲས་ལ།  ,gcig_khang pa bcu gsum de skyes de/_so so lam sang bsdad ma thub pa yin nas/_da phyi rgyal gi deng sang e ar sbi e zer ya bzo 'dra bo dang /_rgya gar nang la nga tsho hom si Di zer ya bzo de 'dras la/__,https://d38pmlk0v88drf.cloudfront.net/wav16k/STT_NW0012_0411_2638060_to_2646326.wav,STT_NW,3,170,8.266,wav16k/STT_NW0012_0411_2638060_to_2646326.wav,བྱས། ཨེ་ནས་ཁང་པ་བཅུ་གསུམ་དེ་གས་དེ། སོ་སོ་ལམ་སང་བསྡད་མ་ཐུབ་པ་ཡིན་ན། ད་ཕྱི་རྒྱལ་གི་དེང་སང་ཨེར་བྷི་ཨན་བི་ཟེར་ཡ་ཟོལ་འདྲ་བོ་དང་། རྒྱ་གར་ནང་ལ་ང་ཚོ་ཧོམ་སྀ་ཊ་ཟེར་ཡ་ཟོལ་འདྲབོ། དེ་འདྲས་ལ་
STT_NW0012_0385_2486805_to_2495737,ཁོ་ཁེ་ཕན་ལེན་སྟངས་དེར། བསམ་བློ་གཏོང་དགོས་རེད་མ་གཏོགས། མི་སེར་ལུང་པ་གཞན་པ་ཞིག་བྱས། འདི་ལ་ཡ་སྐྱབས་བཅོལ་བའི་ཐོབ་ཐང་ལེན་བསྡད་པ་ཡིན་ན། རྒྱ་གར་གཞུང་གིས། ཏན་ཏན་དམ་རུ་འགྲོ་གི་རེད་བསམ་གི་འདུག ཨེ་ནས་དེ།  ,kho khe phan len stangs der/_bsam blo gtong dgos red ma gtogs/_mi ser lung pa gzhan pa zhig byas/_'di la ya skyabs bcol ba'i thob thang len bsdad pa yin na/_rgya gar gzhung gis/_tan tan dam ru 'gro gi red bsam gi 'dug_e nas de/__,https://d38pmlk0v88drf.cloudfront.net/wav16k/STT_NW0012_0385_2486805_to_2495737.wav,STT_NW,3,194,8.932,wav16k/STT_NW0012_0385_2486805_to_2495737.wav,ཁོ་ཁེ་ཕན་བླང་སྟངས་དེ་བསམ་བློ་གཏང་དགོས་རེད་མ་གཏོགས། མི་སེར་ལུང་པ་གཞན་པ་ཞིག་བྱས། དེ་ལ་ཡསྐྱབས་བཅོལ་པའི་ཐོབ་ཐང་ལེན་བསྡད་པ་ཡིན་ན། རྒྱ་གར་གཞུང་གིས་ཏན་ཏན་དམ་མ་རུ་འགྲོ་གི་རེད་བསམ་གི་འདུག ཨ་དེ།
STT_NW0012_0404_2591721_to_2598466,ད་ཁྱོད་རང་ཚོར་ད་རིང་ང་ཚོས་ལམ་འགག་ནི་ཚང་མ་སྟོན་བཞག་ཡོད་ད་ཟེར། ལོ་བཅུ་བཅོ་ལྔ་གི་རྗེས་ལ། སྔོན་མ་སྲིད་སྐྱོང་སྤེན་པ་ཚེ་རིང་སླེབས་ནས། ཁོས་ཁས་ལེན་མང་པོ་ཞིག་བྱས་སོང་།  ,da khyod rang tshor da ring nga tshos lam 'gag ni tshang ma ston bzhag yod da zer/_lo bcu bco lnga gi rjes la/_sngon ma srid skyong spen pa tshe ring slebs nas/_khos khas len mang po zhig byas song /__,https://d38pmlk0v88drf.cloudfront.net/wav16k/STT_NW0012_0404_2591721_to_2598466.wav,STT_NW,3,160,6.745,wav16k/STT_NW0012_0404_2591721_to_2598466.wav,ད་ཁྱེད་རང་ཚོས་ད་རིང་ང་ཚོའི་ལམ་ཀ་ནི་ཚང་མ་བཏོན་བཞག་ཡོད་ད་ཟེ། ལོ་བཅུ་བཅོ་ལྔ་གི་རྗེས་ལ་ སྔན་མ་སྲིད་སྐྱོང་སྤེན་པ་ཚེ་རིང་སླེབས་ནས་ ཁོས་ཁས་ལེན་མང་པོ་ཞིག་བྱས་སོང་།
STT_PC0156_0179_1156903_to_1161095,མཁས་པའི་དབང་པོ་སྐུ་ཞབས་ཚེ་ཏན་ཞབས་དྲུང་ལ་སོགས་པ་བྱུང་པའི་དུས་ཚོད་ནས་དེ་མར་འདབས་ལ།  ,mkhas pa'i dbang po sku zhabs tshe tan zhabs drung la sogs pa byung pa'i dus tshod nas de mar 'dabs la/__,https://d38pmlk0v88drf.cloudfront.net/wav16k/STT_PC0156_0179_1156903_to_1161095.wav,STT_PC,3,82,4.192,wav16k/STT_PC0156_0179_1156903_to_1161095.wav,མཁས་པའི་དབང་པོ་སྐུ་ཞབ་ཚེ་བརྟན་ཞབས་དྲུང་ལ་སོགས་པ་བྱུང་པའི་དུས་ཚོད་ནས་དེ་མེན་འདབ་ལ།
STT_NW0012_0390_2515545_to_2520111,ཨེ་ནས། ས་ཆ་དེ་ཡར་གཞུང་བཞེས་བཏང་ཡ་གི་ད་ཁྲིམས་ཡིག་བཟོས་ཡོད་རེད། སྔོན་མ་ལས།  ,e nas/_sa cha de yar gzhung bzhes btang ya gi da khrims yig bzos yod red/_sngon ma las/__,https://d38pmlk0v88drf.cloudfront.net/wav16k/STT_NW0012_0390_2515545_to_2520111.wav,STT_NW,3,74,4.566,wav16k/STT_NW0012_0390_2515545_to_2520111.wav,ཨེ་ནས།ས་ཆ་དེ་ཡ་གཞུང་བཞེས་གཏང་ཡ་གི་ད་ཁྲིམས་ཡིག་བཟོས་ཡོད་རེད། སྔོན་མ་ལས།
STT_NW0012_0401_2573914_to_2580395,བྱས་ཙང་ང་ཚོས། ཨུ་རུ་ས་ནས་འགོ་བཙུགས་དགོས་ཡ་དེ། རྒྱུ་མཚན་དེ་ཕ་གི་ལ། ས་ཆ་ཨེ་ཀ་བརྒྱ་དང་གསུམ་བཅུ་ཞིག སྔོན་མ་ནས་འཕུལ་ཟིན་པ་ཞིག་ཡོད་པའི་ཆ་ནས། ད་ལས་གཞི།  ,byas tsang nga tshos/_u ru sa nas 'go btsugs dgos ya de/_rgyu mtshan de pha gi la/_sa cha e ka brgya dang gsum bcu zhig_sngon ma nas 'phul zin pa zhig yod pa'i cha nas/_da las gzhi/__,https://d38pmlk0v88drf.cloudfront.net/wav16k/STT_NW0012_0401_2573914_to_2580395.wav,STT_NW,3,146,6.481,wav16k/STT_NW0012_0401_2573914_to_2580395.wav,བྱས་ཙང་ང་ཚོས་ཨོ་རི་ས་ནས་འགོ་བཙུགས་དགོས་ཡ་དེ། རྒྱུ་མཚན་དེ།་ཕ་གི་ལ་ས་ཆ་ཨེ་ཀ་བརྒྱ་དང་སུམ་ཅུ་ཞིག་སྔོན་མ་ནས་ཕུལ་ཟིན་པ་ཞིག་ཡོད་པའི་ཆ་ནས། ད་ལས་གཞི་
STT_MV0059_0216_1442136_to_1449572,ཐེངས་མ་དང་པོ་ཡིན། ཁ་དན་ཚིག་ལ་མ་གནས་ན་ཡོང་ཨ་ཡོང་། སང་ཉིན་ཕྱི་དྲོ་རྒྱུགས་སེ་གོ་བྱུང་ངེ་ཨ། དེ་འདྲའི་རྙོག་དྲ་ཚ་ལ།  ,thengs ma dang po yin/_kha dan tshig la ma gnas na yong a yong /_sang nyin phyi dro rgyugs se go byung nge a/_de 'dra'i rnyog dra tsha la/__,https://d38pmlk0v88drf.cloudfront.net/wav16k/STT_MV0059_0216_1442136_to_1449572.wav,STT_MV,3,111,7.436,wav16k/STT_MV0059_0216_1442136_to_1449572.wav,ཐེངས་མ་དང་པོ་ཡིན། ཁ་དན་ཚིག་ལ་མ་གནས་ན་ཡོང་ཨ་ཡོང་། སང་ཉིན་ཕྱི་དྲོ་རྒྱུགས་ཟེར་གོ་བྱུང་ངེ་ཨ། དེ་འདྲའ་རྙོག་དྲ་ཚ་ལ།
STT_PC0156_0180_1162375_to_1165607,ཨ། དཔེ་རྙིང་ཞིབ་འཇུག ཡིག་རྙིང་ཞིབ་འཇུག་བྱེད་མྱི་མཁས་པ་མང་པོ་བྱུང་ཡོད་རེད།  ,a/_dpe rnying zhib 'jug_yig rnying zhib 'jug byed myi mkhas pa mang po byung yod red/__,https://d38pmlk0v88drf.cloudfront.net/wav16k/STT_PC0156_0180_1162375_to_1165607.wav,STT_PC,3,75,3.232,wav16k/STT_PC0156_0180_1162375_to_1165607.wav,དཔེ་རྙིང་ཞིབ་འཇུག ཡིག་རྙིང་ཞིབ་འཇུག་བྱེད་མྱི་མཁས་པ་མང་པོ་བྱུང་ཡོད་རེད།
STT_NW0012_0392_2527398_to_2534426,ཨེ་ནས། འདི་ཡེ་ས་ཆ་བདག་པོ་བརྒྱབ་ཐུབ་ཀི་མ་རེད། ཨེ་ནས། སྤྱི་པ་ལས་མེད། སྒེར་ལས་མེད། མ་འོངས་པ་སོ་སོ་ལས་མེད། གཞུང་ལས་མེད། ཨེ་ནས།  ,e nas/_'di ye sa cha bdag po brgyab thub ki ma red/_e nas/_spyi pa las med/_sger las med/_ma 'ongs pa so so las med/_gzhung las med/_e nas/__,https://d38pmlk0v88drf.cloudfront.net/wav16k/STT_NW0012_0392_2527398_to_2534426.wav,STT_NW,3,124,7.028,wav16k/STT_NW0012_0392_2527398_to_2534426.wav,ཨེ་ནས་དེར་ས་ཆ་བདག་པོ་བརྒྱབ་ཐུབ་ཀི་མ་རེད་བ། ཨེ་ནས་སྤྱི་པ་ལས་མེད། སྒེར་ལས་མེད། མ་འོངས་པ་སོ་སོ་ལས་མེད། གཞུང་ལས་མེད། ཨེ་ནས།
STT_NW0012_0398_2557347_to_2564999,ཡར་གཡུག་མྱི་ཡིན་ནས་རེད། ག་རེ་ཡིན་པ་ཡིན་ནས། དེ་མང་ཐག་ཆོད་ཅིག་བླངས་ཐུབ་པ་ཡིན་ན། མ་འོངས་པ་གཞུང་གི་ལས་གཞི་འདྲ་བོ་སྒྲིག་དགོས་ཀི་ཡོད་ནས། སོ་ནམ་ལས་གཞི་ཡིན་ནས་འདྲ་འདུག ,yar g.yug myi yin nas red/_ga re yin pa yin nas/_de mang thag chod cig blangs thub pa yin na/_ma 'ongs pa gzhung gi las gzhi 'dra bo sgrig dgos ki yod nas/_so nam las gzhi yin nas 'dra 'dug_,https://d38pmlk0v88drf.cloudfront.net/wav16k/STT_NW0012_0398_2557347_to_2564999.wav,STT_NW,3,160,7.652,wav16k/STT_NW0012_0398_2557347_to_2564999.wav,ཡར་ཤུགས་མྱི་ཡིན་ན་རེད། ག་རེ་ཡིན་པ་ཡིན་ནས། དེ་མང་ཐག་གཅོད་ཅིག་བླང་ཐུབ་པ་ཡིན་ན། མ་འོངས་པ་གཞུང་གི་ལས་གཞི་འདྲ་བོ་སྒྲིག་དགོས་ཀི་ཡོད་ན། བསོད་ནམས་ལས་གཞི་ཡིན་ནས་འདྲ་འདུག
STT_NW0012_0412_2646326_to_2651067,ང་ཚོས་ཡུལ་སྐོར་སྤྲོ་འཆམ་པ་ཡར་རྒྱས་བཏང་དགོས་ཀི་ཡོད་རེད། ཡུལ་སྐོར་སྤྲོ་འཆམ་པ་སླེབས་པ་ཡིན་ནས། བསྡད་ས་དགོས་ཀི་ཡོད་རེད།  ,nga tshos yul skor spro 'cham pa yar rgyas btang dgos ki yod red/_yul skor spro 'cham pa slebs pa yin nas/_bsdad sa dgos ki yod red/__,https://d38pmlk0v88drf.cloudfront.net/wav16k/STT_NW0012_0412_2646326_to_2651067.wav,STT_NW,3,116,4.741,wav16k/STT_NW0012_0412_2646326_to_2651067.wav,ང་ཚོས་ཡུལ་སྐོར་སྤྲོ་འཆམ་པ་ཡར་རྒྱས་གཏང་དགོས་ཀི་ཡོད་རེད། ཡུལ་སྐོར་སྤྲོ་འཆམ་པ་སླེབས་པ་ཡིན་ན། བསྡད་ས་དགོས་ཀི་ཡོད་རེད།
STT_MV0065_0086_778703_to_786291,དྲག་རུ་ཕྱིན་ཤག དྲག་རུ་ཕྱིན་ཤག ཁྲུས་གདན་གཅིག་པུར་གཉིས་ཙི་ཕྱིན་སོང་ང་། ཧེ་ཧེ་ཧེ། འདི་རང་གི་ནང་རེད་པེ།  ,drag ru phyin shag_drag ru phyin shag_khrus gdan gcig pur gnyis tsi phyin song nga /_he he he/_'di rang gi nang red pe/__,https://d38pmlk0v88drf.cloudfront.net/wav16k/STT_MV0065_0086_778703_to_786291.wav,STT_MV,3,101,7.588,wav16k/STT_MV0065_0086_778703_to_786291.wav,དྲག་རུ་ཕྱིན་ཤག དྲག་རུ་ཕྱིན་ཤག ཁྲུ་གདན་གཅིག་པུར་གཉིས་ཙི་ཕྱིན་སོང་ང་། ཧ་ཧ་ཧ་ཧ། འདི་རང་གི་ནང་རེད་པེ།
